{
  "config_hash": "eb9895f97ecc0a904252a15341446c2d208e43fd6659da4858ff1bee620a5b72",
  "config_path": ".sdlc/config.json",
  "created_at": "2026-07-27T18:23:38.814Z",
  "defaults_profile": {
    "id": "sdlc-config:v1@plugin-0.12.0",
    "sha256": "e248f4e1ebfaf5402a762bcdebcdefd399ade7e83921a62494e5eb271f0afda9"
  },
  "effective_config_hash": "eb9895f97ecc0a904252a15341446c2d208e43fd6659da4858ff1bee620a5b72",
  "hash_algorithm": "sha256:stable-json:v1",
  "inherited_paths": [
    "/autonomy_policy",
    "/baseline_policy",
    "/context_optimization_policy",
    "/observability"
  ],
  "kind": "effective_config_lock",
  "lock_hash": "eccc5afe2b7511b3e90f6980eab9c5f4cac01a883e7be897fc584d5d94af7f26",
  "schema_version": "effective-config-lock:v1"
}
